{
  "$schema": "../../schemas/libFormula.schema.json",
  "name": "Equals",
  "description": "Compute if values are identical.",
  "arguments": [
    {
      "name": "First",
      "formula": {
        "type": "value",
        "value": ""
      },
      "description": "First Value",
      "type": {
        "type": "Any"
      }
    },
    {
      "name": "Second",
      "formula": {
        "type": "value",
        "value": ""
      },
      "description": "Second Value",
      "type": {
        "type": "Any"
      }
    }
  ],
  "output": {
    "description": "Returns True if the input values are identical, otherwise False.",
    "type": {
      "type": "Boolean"
    }
  }
}
