{
  "$schema": "../../schemas/libFormula.schema.json",
  "name": "Round up",
  "description": "Round a Number up to the nearest decimal point.",
  "arguments": [
    {
      "name": "Input",
      "description": "Number to round up.",
      "type": {
        "type": "Number"
      },
      "formula": {
        "type": "value",
        "value": 1
      }
    },
    {
      "name": "Decimals",
      "description": "Number of decimals to round to.",
      "type": {
        "type": "Number"
      },
      "formula": {
        "type": "value",
        "value": 0
      }
    }
  ],
  "output": {
    "type": {
      "type": "Number"
    },
    "description": "The rounded Number."
  }
}
