{
  "$schema": "../../schemas/libFormula.schema.json",
  "name": "Less than",
  "description": "Compute if a value is smaller than another value.",
  "arguments": [
    {
      "name": "First",
      "formula": {
        "type": "value",
        "value": ""
      },
      "description": "First Number to be compared.",
      "type": {
        "type": "Number"
      }
    },
    {
      "name": "Second",
      "formula": {
        "type": "value",
        "value": ""
      },
      "description": "Second Number to be compared.",
      "type": {
        "type": "Number"
      }
    }
  ],
  "output": {
    "description": "Returns True if the First Number is smaller than the second Number, otherwise it returns False.",
    "type": {
      "type": "Boolean"
    }
  }
}
