{
  "$schema": "../../schemas/libFormula.schema.json",
  "name": "Parse JSON",
  "description": "Parse a String to JSON.",
  "arguments": [
    {
      "name": "JSON string",
      "formula": {
        "type": "value",
        "value": null
      },
      "description": "The String to be parsed.",
      "type": {
        "type": "String"
      }
    },
    {
      "name": "Date parsing",
      "formula": {
        "type": "value",
        "value": false
      },
      "description": "Whether to attempt parsing date strings to Date objects. This can have a significant impact on performance, so it is disabled by default.",
      "type": {
        "type": "Boolean"
      }
    }
  ],
  "output": {
    "description": "The parsed JSON value. If the input is not a valid String, this returns Null.",
    "type": {
      "type": "Any"
    }
  }
}
