{
  "$schema": "../../schemas/libFormula.schema.json",
  "name": "Every",
  "description": "Run a formula returns for all items in an Array.",
  "arguments": [
    {
      "name": "Array",
      "formula": {
        "type": "value",
        "value": null
      },
      "description": "The array of items to evaluate.",
      "type": {
        "type": "Array"
      }
    },
    {
      "name": "Formula",
      "isFunction": true,
      "formula": {
        "type": "path",
        "path": ["Args", "item"]
      },
      "description": "Predicate formula for evaluating each item.",
      "type": {
        "type": "Formula"
      }
    }
  ],
  "output": {
    "description": "Returns True if the predicate formula returns true for all items in the Array, otherwise False.",
    "type": {
      "type": "Array"
    }
  }
}
