{
  "$schema": "../../schemas/libFormula.schema.json",
  "name": "Take last",
  "description": "Take items from the end of an Array or String.",
  "arguments": [
    {
      "name": "Array",
      "formula": {
        "type": "value",
        "value": null
      },
      "description": "The input value.",
      "type": {
        "type": "Array \\| String"
      }
    },
    {
      "name": "Count",
      "formula": {
        "type": "value",
        "value": 1
      },
      "description": "Number of items to take.",
      "type": {
        "type": "Number"
      }
    }
  ],
  "output": {
    "description": "The last items from the Array or String.",
    "type": {
      "type": "Array \\| String"
    }
  }
}
