{
  "$schema": "../../schemas/libFormula.schema.json",
  "name": "Last Index of",
  "description": "Search an Array or String to find the index of the last occurrence of a specified item or substring.",
  "arguments": [
    {
      "name": "Array",
      "formula": {
        "type": "value",
        "value": ""
      },
      "description": "The value to search.",
      "type": {
        "type": "Array \\| String"
      }
    },
    {
      "name": "Item",
      "formula": {
        "type": "value",
        "value": ""
      },
      "description": "The item or substring to search for.",
      "type": {
        "type": "Any"
      }
    }
  ],
  "output": {
    "description": "If the item or substring exists in the Array, the last index of that item is returned. If the item is not found, -1 is returned.",
    "type": {
      "type": "Number"
    }
  }
}
