{
  "$schema": "../../schemas/libFormula.schema.json",
  "name": "Get from Session Storage",
  "description": "Read a value from session storage with the provided key.\n If the value is a JSON string it is automatically parsed before it is returned.\nYou do not need to use the parseJSON formula",
  "cache": false,
  "arguments": [
    {
      "name": "Key",
      "formula": {
        "type": "value",
        "value": null
      },
      "description": "The key to read from session storage.",
      "type": {
        "type": "String"
      }
    }
  ],
  "output": {
    "description": "The value found in session storage.",
    "type": {
      "type": "Any"
    }
  }
}
